{
  "name": "Luke koala",
  "author": "Tony Monroe",
  "source": "original",
  "tags": [],
  "dateAdded": "2026-02-12",
  "art": "  $thoughts\n   $thoughts          .\n       ___   //\n     {~$eye_$eye~}// \n      ( Y )K/  \n     ()~*~()   \n     (_)-(_)   \n     Luke    \n     Skywalker\n     koala"
}
