{
  "name": "Yasuna_05",
  "author": "Tony Monroe",
  "source": "original",
  "tags": [],
  "dateAdded": "2026-02-12",
  "art": "$thoughts\n    $thoughts\n       ／ .: .: .: .: .: .: .:  .: .: . ＼\n     ./   .: .: .: .: .: .: .:  .: .: .: .ヽ\n     /          /  . ..l..  ヽ.: .: .: .: .:.\n    ,    .. .: /  .| : ハ: .|  ＼.: .: .: .: .\n    |.: .:.l.:/  ヽ|.:/  ､ .|.ノ ＼ .l:.: .: |\n    |.: .:.|:/.ｨ≠ﾐ|:/    ＼| ィ≠ミ､|.:.: .:|\n    |.: .: ノ /Y::::ヽ       Y::::ヽヽ＼ .: ｜\n   /:.: /^|:|{.{:::::}       {:::::}.} |:|ヽ:､\n ノ:ノ: { |:| Ｕうーソ       うーソ  |:| }ヽ:＼\n    | : ヽ|.|  '' ￣           ￣ ''U|:| /:|\n     :: ::人|                        |人::ﾘ\n     Vﾊ:: :: \\                     /::  ﾊ/\n      \\|ヽ:: ::ヽ､     --      ,イ::／|／\n          ＼| ヽ:≧=r-r---r-r=≦:ノ|／\n             . :´:.ヽ二二.ノ: :｀: .\n            ／: : :  ／ハ＼: : : : ＼"
}
