{
  "name": "Black mesa",
  "author": "Tony Monroe",
  "source": "original",
  "tags": [],
  "dateAdded": "2026-02-12",
  "art": "    $thoughts\n     $thoughts\n           .-;+\\$XHHHHHHX\\$+;-.\n        ,;X\\@\\@X%/;=----=:/%X\\@\\@X/,\n      =\\$\\@\\@%=.              .=+H\\@X:\n    -XMX:                      =XMX=\n   /\\@\\@:                          =H\\@+\n  %\\@X,                            .\\$\\@\\$\n +\\@X.                               \\$\\@%\n-\\@\\@,                                .\\@\\@=\n%\\@%                                  +\\@\\$\nH\\@:                                  :\\@H\nH\\@:         :HHHHHHHHHHHHHHHHHHX,    =\\@H\n%\\@%         ;\\@M\\@\\@\\@\\@\\@\\@\\@\\@\\@\\@\\@\\@\\@\\@\\@\\@\\@H-   +\\@\\$\n=\\@\\@,        :\\@\\@\\@\\@\\@\\@\\@\\@\\@\\@\\@\\@\\@\\@\\@\\@\\@\\@\\@\\@\\@= .\\@\\@:\n +\\@X        :\\@\\@\\@\\@\\@\\@\\@\\@\\@\\@\\@\\@\\@\\@\\@M\\@\\@\\@\\@\\@\\@:%\\@%\n  \\$\\@\\$,      ;\\@\\@\\@\\@\\@\\@\\@\\@\\@\\@\\@\\@\\@\\@\\@\\@\\@M\\@\\@\\@\\@\\@\\@\\$.\n   +\\@\\@HHHHHHH\\@\\@\\@\\@\\@\\@\\@\\@\\@\\@\\@\\@\\@\\@\\@\\@\\@\\@\\@\\@\\@\\@\\@+\n    =X\\@\\@\\@\\@\\@\\@\\@\\@\\@\\@\\@\\@\\@\\@\\@\\@\\@\\@\\@\\@\\@\\@\\@\\@\\@\\@\\@\\@X=\n      :\\$\\@\\@\\@\\@\\@\\@\\@\\@\\@\\@\\@\\@\\@\\@\\@\\@\\@\\@\\@M\\@\\@\\@\\@\\$:\n        ,;\\$\\@\\@\\@\\@\\@\\@\\@\\@\\@\\@\\@\\@\\@\\@\\@\\@\\@\\@X/-\n           .-;+\\$XXHHHHHX\\$+;-."
}
