{
  "name": "Ren",
  "author": "Tony Monroe",
  "source": "original",
  "tags": [],
  "dateAdded": "2026-02-12",
  "art": "$thoughts\n    $thoughts\n    ____  \n   /# /_\\\\_\n  |  |/$eye\\\\$eye\\\\\n  |  \\\\\\\\_/_/\n / |_   |  \n|  ||\\\\_ ~| \n|  ||| \\\\/  \n|  |||_    \n \\\\//  |    \n  ||  |    \n  ||_  \\\\   \n  \\\\_|  o|  \n  /\\\\___/   \n /  ||||__ \n    (___)_)"
}
