{
  "name": "Yasuna_09",
  "author": "Tony Monroe",
  "source": "original",
  "tags": [],
  "dateAdded": "2026-02-12",
  "art": "  $thoughts\n   $thoughts\n    $thoughts\n    \n           ____\n       ,: .: .: :.ヽ\n     ,'       /\\   ｉ\n     {: .:ﾉﾚﾍ/  Viﾍ:}\n    .{,､〈 Ｏ   Ｏ{.:.\n    ノヽ\\!\"       }.:ﾊ\n      Ｗﾊw=-､へ,ｬ<,V'      \n         /ﾍ }{./\\\n        ;: i:V:!;}\n        |:｜: :｜}\n        |:|:｡: ｡l}\n        >-'-ﾟ-'`ﾟu\n        ｰi-i～i-i~\n         |.|  |.|\n         |-|  |-|\n         ヒｺ  ヒｺ"
}
