{
  "name": "Periodic table",
  "author": "Tony Monroe",
  "source": "original",
  "tags": [],
  "dateAdded": "2026-02-12",
  "art": "$thoughts\n $thoughts\n   1A   2A                                         3A  4A  5A  6A  7A  8A\n  -----                                                               -----\n1 | H |                                                               |He |\n  |---+----                                       --------------------+---|\n2 |Li |Be |                                       | B | C | N | O | F |Ne |\n  |---+---|                                       |---+---+---+---+---+---|\n3 |Na |Mg |3B  4B  5B  6B  7B |    8B     |1B  2B |Al |Si | P | S |Cl |Ar |\n  |---+---+---------------------------------------+---+---+---+---+---+---|\n4 | K |Ca |Sc |Ti | V |Cr |Mn |Fe |Co |Ni |Cu |Zn |Ga |Ge |As |Se |Br |Kr |\n  |---+---+---+---+---+---+---+---+---+---+---+---+---+---+---+---+---+---|\n5 |Rb |Sr | Y |Zr |Nb |Mo |Tc |Ru |Rh |Pd |Ag |Cd |In |Sn |Sb |Te | I |Xe |\n  |---+---+---+---+---+---+---+---+---+---+---+---+---+---+---+---+---+---|\n6 |Cs |Ba |Lu |Hf |Ta | W |Re |Os |Ir |Pt |Au |Hg |Tl |Pb |Bi |Po |At |Rn |\n  |---+---+---+---+---+---+---+---+---+---+---+---+---+---+---+---+---+---|\n7 |Fr |Ra |Lr |Rf |Db |Sg |Bh |Hs |Mt |Ds |Rg |Cn |Nh |Fl |Mc |Lv |Ts |Og |\n  -------------------------------------------------------------------------\n              -------------------------------------------------------------\n   Lanthanide |La |Ce |Pr |Nd |Pm |Sm |Eu |Gd |Tb |Dy |Ho |Er |Tm |Yb |Lu |\n              |---+---+---+---+---+---+---+---+---+---+---+---+---+---+---|\n   Actinide   |Ac |Th |Pa | U |Np |Pu |Am |Cm |Bk |Cf |Es |Fm |Md |No |Lr |\n              -------------------------------------------------------------"
}
