{
  "name": "Cube",
  "author": "Tony Monroe",
  "source": "original",
  "tags": [],
  "dateAdded": "2026-02-12",
  "art": "   $thoughts\n    $thoughts\n       ____________\n      /\\  ________ \\\n     / /\\ \\______/\\ \\\n    / / /\\ \\  / /\\ \\ \\\n   / / /__\\ \\/ / /\\ \\ \\\n  / /_/____\\ \\/_/__\\_\\ \\\n  \\ \\ \\____/ / ________ \\\n   \\ \\ \\  / / /\\ \\  / / /\n    \\ \\ \\/ / /\\ \\ \\/ / /\n     \\ \\/ / /__\\_\\/ / /\n      \\  / /______\\/ /\n       \\/___________/"
}
