{
  "name": "Maze runner",
  "author": "Tony Monroe",
  "source": "original",
  "tags": [],
  "dateAdded": "2026-02-12",
  "art": "    $thoughts\n     $thoughts\n      $thoughts\n       \\\n        \\\n         \\\n    \\     \\                     /\n     \\     \\                   /\n      \\     \\                 /\n       ]     \\               [    ,'|\n       ]      \\              [   /  |\n       ]___               ___[ ,'   |\n       ]  ]\\             /[  [ |:   |\n       ]  ] \\           / [  [ |:   |\n       ]  ]  ]         [  [  [ |:   |\n       ]  ]  ]__     __[  [  [ |:   |\n       ]  ]  ] ]\\ _ /[ [  [  [ |:   |\n       ]  ]  ] ] (#) [ [  [  [ :===='\n       ]  ]  ]_].nHn.[_[  [  [\n       ]  ]  ]  HHHHH. [  [  [\n       ]  ] /   `HH(\"N  \\ [  [\n       ]__]/     HHH  \"  \\[__[\n       ]         NNN         [\n       ]         N/\"         [\n       ]         N H         [\n      /          N            \\\n     /           q,            \\\n    /                           \\"
}
