{
  "name": "Yasuna_11",
  "author": "Tony Monroe",
  "source": "original",
  "tags": [],
  "dateAdded": "2026-02-12",
  "art": "  $thoughts\n   $thoughts          . .: -ーー― :._\n    $thoughts       ／.: .: .: .:     ＞  r⌒ヽ\n           / .:         ｜.､.:＼  ﾉ ノ\n          .: .: .:|＼  |斗ﾍﾄ.:.:Ｖ  /\n          |: .: /\\|ノ＼| ／ Ｖ::Ｎ./\n          |: .:/ c─-        Ｙ:| /\n          |:ﾊ:{``   ,  --┐  人V /\n          ﾉ:L＼>   く_,￣┘／  ＼\n   /⌒￣￣￣|￣￣＞--r-rｭ＜|   ／\n   L_,vー─-|    ､ }  ＶYﾊ   Y\n             ￣￣Ｖ  ｜/∧   ﾍ\n                  {   |//∧  ﾍ\n                  {    ＼//   ﾍ\n                  {            ＼\n                  ｝             >"
}
