{
  "name": "Psychiatrichelp",
  "author": "Tony Monroe",
  "source": "original",
  "tags": [],
  "dateAdded": "2026-02-12",
  "art": "$thoughts         ____________________\n         $thoughts       |                    |\n          $thoughts      |     PSYCHIATRIC    |\n           $thoughts     |        HELP        |\n            $thoughts    |____________________|\n             $thoughts   ||  ,-..'``.        ||\n              $thoughts  || (,-..'`. )       ||\n                 ||   )-c - `)\\      ||\n   ,.,._.-.,_,.,-||,.(`.--  ,`',.-,_,||.-.,.,-,._.\n              ___||____,`,'--._______||\n             |`._||______`'__________||\n             |   ||     __           ||\n             |   ||    |.-' ,|-      ||\n   _,_,,..-,_|   ||    ._)) `|-      ||,.,_,_.-.,_\n            . `._||__________________||   ____    .\n     .              .           .     . <.____`>\n   .SSt  .      .     .      .    .   _.()`'()`'  ."
}
