{
  "name": "Cake",
  "author": "Tony Monroe",
  "source": "original",
  "tags": [],
  "dateAdded": "2026-02-12",
  "art": "$thoughts\n     $thoughts\n            ,:/+/-\n            /M/              .,-=;//;-\n       .:/= ;MH/,    ,=/+%\\$XH@MM#@:\n      -\\$##@+\\$###@H@MMM#######H:.    -/H#\n .,H@H@ X######@ -H#####@+-     -+H###@X\n  .,@##H;      +XM##M/,     =%@###@X;-\nX%-  :M##########$.    .:%M###@%:\nM##H,   +H@@@$/-.  ,;\\$M###@%,          -\nM####M=,,---,.-%%H####M\\$:          ,+@##\n@##################@/.         :%H##@\\$-\nM###############H,         ;HM##M\\$=\n\\#################.    .=\\$M##M\\$=\n\\#################H..;XM##M\\$=          .:+\nM###################@%=           =+@MH%\n@################M/.          =+H#X%=\n=+M##############M,       -/X#X+;.\n  .;XM##########H=    ,/X#H+:,\n     .=+HM######M+/+HM@+=.\n         ,:/%XM####H/.\n              ,.:=-."
}
