{
  "name": "Catfence",
  "author": "Tony Monroe",
  "source": "original",
  "tags": [],
  "dateAdded": "2026-02-12",
  "art": "$thoughts     *     ,MMM8&&&.            *\n                  MMMM88&&&&&    .\n        $thoughts        MMMM88&&&&&&&\n     *           MMM88&&&&&&&&\n         $thoughts       MMM88&&&&&&&&\n                 'MMM88&&&&&&'\n          $thoughts        'MMM8&&&'      *\n          |\\\\___/|\n         =) $eyeY$eye (=            .              '\n          \\\\  ^  /\n           )=*=(       *\n          /     \\\\\n          |     |\n         /| | | |\\\\\n         \\\\| | |_|/\\\\\n  _/\\\\_/\\\\_//_// ___/\\\\_/\\\\_/\\\\_/\\\\_/\\\\_/\\\\_/\\\\_/\\\\_/\\\\_\n  |  |  |  | \\\\_) |  |  |  |  |  |  |  |  |  |\n  |  |  |  |  |  |  |  |  |  |  |  |  |  |  |\n  |  |  |  |  |  |  |  |  |  |  |  |  |  |  |     \n  |  |  |  |  |  |  |  |  |  |  |  |  |  |  |\n  |  |  |  |  |  |  |  |  |  |  |  |  |  |  |"
}
