{
  "name": "Spidercow",
  "author": "Tony Monroe",
  "source": "original",
  "tags": [],
  "dateAdded": "2026-02-12",
  "art": "$thoughts     (\n           $thoughts     )\n            $thoughts   (\n         /\\\\  .-\"\"\"\"-.  /\\\\\n        //\\\\\\\\/  ,,,,  \\\\//\\\\\\\\\n        |/\\\\| ,;;;;;;, |/\\\\|\n        //\\\\\\\\\\\\;-\"\"\"\"-;///\\\\\\\\\n       //  \\\\/   ..   \\\\/  \\\\\\\\\n      (| ,-_| \\\\ || / |_-, |)\n        //`__(\\\\(__)/)__`\\\\\\\\\n       // /.-\\\\`($eyes)'/-.\\\\ \\\\\\\\\n      (\\\\ |)   ')  ('   (| /)\n       ` (|   (o  o)   |) `\n         \\\\)    `--'    (/\n                $tongue"
}
