{
  "name": "Atat",
  "author": "Tony Monroe",
  "source": "original",
  "tags": [],
  "dateAdded": "2026-02-12",
  "art": "$thoughts                         ________\n   $thoughts                    _.-Y  |  |  Y-.,_\n    $thoughts                .-\"   |  |  |  ||   \"~-.      \n          _____     |\"\"[]\"|\" !\"\"! \"|\"==\"\" \"I      \n       .-\"{-. \"I----]_   :|------..| []  __L      \n      P-=}=(r\\_I]_[L__] _l|______l |..  |___I     \n      ^-=\\[_c=-'  ~j______[________]_L______L]    \n                    [_L--.\\_==I|I==/.--.j_I_/     \n                      j)==([\"-----`])==((_]       \n                       I--I\"~~\"\"\"~~\"I--I          \n                       |[]|         |[]|          \n                       j__l         j__l          \n                       |!!|         |!!|          \n                       |..|         |..|         \n                       )[](         )[](          \n                       ]--[         ]--[          \n                       [L_]         [L_]          \n                      /|..|\\       /|..|\\         \n                     '={--}=`     '={--}=`        \n                    .-^-r--^-.   .-^-r--^-.       \n~~~~~~~~~~~~~~~~~~~~~~~~~~~~~~~~~~~~~~~~~~~~~~~~\nModified ATAT from Row  (the Ascii-Wizard of Oz)"
}
