{
  "name": "Chito",
  "author": "Tony Monroe",
  "source": "original",
  "tags": [],
  "dateAdded": "2026-02-12",
  "art": "$thoughts\n    $thoughts\n                -一     一-\n        ／                       ＼\n       /             ________\n      /     -~                     ミ､\n      レ'     _  一ｧiァ ￢}￣Tii一- _  ＼\n    ／    --::|::::/斗士  /   |[_Vい＿＞」\n  ／ イ「::::|:::Y/  ｲ::ハ      ｨ-ﾐヽい\n  ＜___｜:::へ|::|{ 乂-夕     {::ｄﾘ|い\n        ＼八 |::｜             `''   ﾊ|\n    ＿ --＼ヽ|::|                  .ｲ ﾘ\n  ／------.ゝ|:ﾄ|        -       ィ:|\n  ＼        ＞ミ|`ヽ!ﾆ  T  ﾌ￣.≧｜:/\n     ∨         |::\\/ }-/く＼   /｜/"
}
