{
  "name": "Kiss",
  "author": "Tony Monroe",
  "source": "original",
  "tags": [],
  "dateAdded": "2026-02-12",
  "art": "$thoughts\n      $thoughts\n             ,;;;;;;;,\n            ;;;;;;;;;;;,\n           ;;;;;'_____;'\n           ;;;(/))))|((\\\n           _;;((((((|))))\n          / |_\\\\\\\\\\\\\\\\\\\\\\\\\n     .--~(  \\ ~))))))))))))\n    /     \\  `\\-(((((((((((\\\\\n    |    | `\\   ) |\\       /|)\n     |    |  `. _/  \\_____/ |\n      |    , `\\~            /\n       |    \\  \\           /\n      | `.   `\\|          /\n      |   ~-   `\\        /\n       \\____~._/~ -_,   (\\\n        |-----|\\   \\    ';;\n       |      | :;;;'     \\\n      |  /    |            |\n      |       |            |"
}
