{
  "name": "Lobster",
  "author": "Tony Monroe",
  "source": "original",
  "tags": [],
  "dateAdded": "2026-02-12",
  "art": "             $thoughts\n              $thoughts\n                             ,.---._\n                   ,,,,     /       `,\n                    \\\\\\\\   /    '\\_  ;\n                     |||| /\\/``-.__\\;'\n                     ::::/\\/_\n     {{`-.__.-'(`(^^(^^^(^ 9 `.========='\n    {{{{{{ { ( ( (  (   (-----:=\n     {{.-'~~'-.(,(,,(,,,(__6_.'=========.\n                     ::::\\/\\\n                     |||| \\/\\  ,-'/,\n                    ////   \\ `` _/ ;\n                   ''''     \\  `  .'\n                             `---'"
}
