{
  "name": "Skeleton",
  "author": "Tony Monroe",
  "source": "original",
  "tags": [],
  "dateAdded": "2026-02-12",
  "art": "          $thoughts      (__)      \n           $thoughts     /$eyes|  \n            $thoughts   (_\"_)*+++++++++*\n                   //I#\\\\\\\\\\\\\\\\I\\\n                   I[I|I|||||I I `\n                   I`I'///'' I I\n                   I I       I I\n                   ~ ~       ~ ~\n                     Scowleton"
}
