{
  "name": "Hiya",
  "author": "Tony Monroe",
  "source": "original",
  "tags": [],
  "dateAdded": "2026-02-12",
  "art": "           $thoughts     (      )\n            $thoughts    ~(^^^^)~\n             $thoughts    ) $eyes \\~_          |\\\n              $thoughts  /     | \\        \\~ /\n                ( 0  0  ) \\        | |\n                 ---___/~  \\       | |\n                  /'__/ |   ~-_____/ |\n   o          _   ~----~      ___---~\n     O       //     |         |\n            ((~\\  _|         -|\n      o  O //-_ \\/ |        ~  |\n           ^   \\_ /         ~  |\n                  |          ~ |\n                  |     /     ~ |\n                  |     (       |\n                   \\     \\      /\\\n                  / -_____-\\   \\ ~~-*\n                  |  /       \\  \\       .==.\n                  / /         / /       |  |\n                /~  |      //~  |       |__|         W<\n                ~~~~        ~~~~"
}
