{
  "name": "Jellyfish",
  "author": "Tony Monroe",
  "source": "original",
  "tags": [],
  "dateAdded": "2026-02-12",
  "art": "     $thoughts\n      $thoughts\n\n         .-;\\':\\':\\'-.\n        {\\'.\\'.\\'.\\'.\\'.}\n         )        \\'`.\n        \\'-. ._ ,_.-=\\'\n          `). ( `);(\n          (\\'. .)(,\\'.)\n           ) ( ,\\').(\n          ( .\\').\\'(\\').\n          .) (\\' ).(\\'\n           '  ) (  ).\n            .\\'( .)\\'\n              .).\\'\njgs"
}
