{
  "name": "Yasuna_18",
  "author": "Tony Monroe",
  "source": "original",
  "tags": [],
  "dateAdded": "2026-02-12",
  "art": "   $thoughts\n    $thoughts\n                      ,:二二二二:. .,\n                   ／.／＿＿＿_  ＼.:＼\n                  /. /／.: .: .:＼  : .:＼\n                 /.: .: .:/｜:/\\ .:＼}.: .:.\n                .: |.:/一/ |:/ 一.:}: .: .:｜\n                |.:|ノ |/_｜/ _  \\/ﾍ: .: .:|\n                |.: ｜= ＝    ＝＝= \\/}: .:|\n                |:: ﾘ''           '' /:/､.:|\n               ノ:|:人    一一 ､    /:/ ﾉ.:|\n                , ┴＜＼  {     ｝ ,{:/イ::八\n               /_..   ＼` ー┬一r＜:八八／\n               ／  T＼   `＜}ゞ=彡'⌒＼＼_>\n              /___ |  >､    ｀''＼   ｜\n             /ﾆ}::\\/／  ＼       ｜  ｜\n          　{ﾆﾉ:: /''＼ | `|r--ｯ＜|_／|\n           /__   V    ｝|  》=《      |\n           ＼ ＼/｀一ﾍノ|  { 6 }     ｛ \n             ￣        ｢   ゞ= '      }\n                      ﾉ               〉"
}
