{
  "name": "Atom",
  "author": "Tony Monroe",
  "source": "original",
  "tags": [],
  "dateAdded": "2026-02-12",
  "art": "$thoughts\n        $thoughts\n                  =/;;/-\n                 +:    //\n                /;      /;\n               -X        H.\n .//;;;:;;-,   X=        :+   .-;:=;:;%;.\n M-       ,=;;;#:,      ,:#;;:=,       ,\\@\n :%           :%.=/++++/=.\\$=           %=\n  ,%;         %/:+/;,,/++:+/         ;+.\n    ,+/.    ,;\\@+,        ,%H;,    ,/+,\n       ;+;;/= \\@.  .H##X   -X :///+;\n       ;+=;;;.\\@,  .XM\\@\\$.  =X.//;=%/.\n    ,;:      :\\@%=        =\\$H:     .+%-\n  ,%=         %;-///==///-//         =%,\n ;+           :%-;;;:;;;;-X-           +:\n \\@-      .-;;;;M-        =M/;;;-.      -X\n  :;;::;;-.    %-        :+    ,-;;-;:==\n               ,X        H.\n                ;/      %=\n                 //    +;\n                  ,////,"
}
