{
  "name": "Ackbar",
  "author": "Tony Monroe",
  "source": "original",
  "tags": [],
  "dateAdded": "2026-02-12",
  "art": "$thoughts\n          $thoughts\n                      ?IIIIIII7II?????+\n                   ~III777II777I?+==++==+:\n                  ???I7I???I7II++=====++===\n                 ??+??????????+===~~=+++??==+\n                ??+??II??????+==~=~~=+++++==++\n               I+?????????+?+====~=~==+==++?==?\n              ?????II?????+++++=======?===~~~~==\n            ,?????II????????++++====~===::~~~~:~\n            I?I??II?+++??+?+++==~~~~:~:~:,:,,:::~\n           I??????+==+???++++=~~:~:~:,:::,:,,,,,::\n          +I?++++=+=+????+++=~~:~~:::,,,,::,,,:,:\n          I??+?+====+???+++===~~::::,::,:,,,,,,::\n         I????=~===++?+=+=~==~:~~:,,,,,,,.,,,,,:~\n        =??+?=~~~~??+?+===~~==,==~~~~,,,,..,,,.:=\n        II++==~~=++++++=~~=~,~+=?+?=I?++=..,.,,:\n     IIII?+?=====+~+++~=~~~:::=~+~===:,,,,,.,.::\n    I?=?I+??+=~=~?I?=+=~~~::,~~=~::~=::,,,,,,::\n    ?+I??++=++~,::+++~~~:::,,=~~=,~,..,::.:\n    ++=+?++~=:~::I+,~=:~,:,,,,:~~......::~,,,\n     ~=~=:.++~:,.,~=::::.,,:,.:~,:=...==~,::\n     =~?++??+=~~,.:?~.:,:,,,.,::,,~:=~=::,~\n     ++~~:~===~:~,.~::,~=~.:,..,:,,:==:.,:7\n     ~~,::...:=:,::+:~:.,~,...,.,,,,::~,,::~=\n      =~===+=~~,.::,,,:::,..,,,,,,,,,,,:,..,=+?\n      ~=~=~::~~~::,.,,,~:.+,..,,,,..,,,,...,+I?\n      ~==~:~~:~~,~=~~:,:~,:,,,,,,....,,,..+?I?I\n      ~=~=+,:~:=,:~~~~~~::::,.,,.,,.,,,..~+????I\n      ~=~==~=:~~:,~~~~~:::,::,.,,,..,,,I77I?+??II\n      +I7:::~~=~:,::~~~~.=.,~,,,,...,~7III?+??II7\n     777?+~:=~=~~:,::~~:::.,,,,,,,,,777II??I777777\n     777I==:=~::~~~~::~:::,:,:~:::,777I???777777777\n    7777+,~===~:~:~~~~:::,.~:=,,:777II???77777777777=?\n    777I~,~~~=~::~:,:,,,:=~~,,:7777I???I7777777777+=++\n  I7777I,,:,.==::::,:,,,,::::7777I+??I77777777777??I7I7,\n ,77777I::,..~~:,,,,,,.,:~I7777I+??I777777777777?I7777777,\n 77777777,...~~:,,,,,.,77777I7???II777777777777+?7777777777\n77777777777:,~~~,,=7777777I???II777777777777777+77777777777\n77777777777777777777777I+7?7II77777777777777777+777777777777"
}
